question,answer
"how to get my moodle id and password","If you completed the college registration form during admission, the university will send your Moodle ID and password to your email."
"i haven't filled the college registration form what should i do","Please fill the university registration form here: https://admissions.mitsweb.in."
"i forgot my moodle id","Contact your class coordinator to retrieve your Moodle ID, or check your university email."
"i forgot my moodle password","Use the 'Forgot Password' option on the Moodle login page. Enter your university email ID and check your inbox for the reset link."
"my moodle courses are not visible","Contact your course faculty to enroll you in their courses, or reach out to your class coordinator."
"how to correct my date of birth email or phone number","Contact the student section or email goffice@mitsgwalior.in with proof. You may also call 07512409325."
"when will ims registration start","IMS registration is currently not open. Keep checking the university website for updates."
"what is the moodle website address","MITS has two Moodle servers: http://moodle.mitsgwalior.in (before 2024 students) and https://moodle.mitseb.in (2024 students)."
"i am not getting any email for moodle or university email id","All newly admitted students receive Moodle and university email IDs. Contact your class coordinator; default password is your phone number."
